{
    "$schema": "https://raw.githubusercontent.com/YouKnow232/GearLoader/refs/heads/mod-manager/schema/config.schema.json",
    "name": "example_c_mod",
    "version": "0.1.0",
    "modLoaderVersion": "0.1.0",
    "dependencies": [
        {
            "name": "baseMod"
        }
    ]
}