{
    "$schema": "https://raw.githubusercontent.com/YouKnow232/GearLoader/refs/heads/main/schema/0.1.0/config.schema.json",
    "name": "example_cpp_mod",
    "version": "0.1.0",
    "modLoaderVersion": "0.1.0",
    "dependencies": [
        {
            "name": "baseMod"
        }
    ]
}