{
    "$schema": "https://raw.githubusercontent.com/YouKnow232/GearLoader/refs/heads/main/schema/0.1.0/config.schema.json",
    "name": "modB",
    "entryPoint": "subdirectory/dummyModB.dll",
    "version": "0.1.1",
    "dependencies": [
        {
            "name": "modA"
        }
    ]
}