{
    "$schema": "https://raw.githubusercontent.com/YouKnow232/GearLoader/refs/heads/mod-manager/schema/0.1.0/config.schema.json",
    "name": "baseModTester",
    "version": "0.1.0",
    "modLoaderVersion": "0.1.0",
    "dependencies": [
        {
            "name": "baseMod",
            "version": "=0.1.0"
        }
    ]
}